{
  "application": {
    "applicability": "required",
    "check_id": "application.valid",
    "evidence": [
      {
        "actual_state": "available",
        "actual_value": {
          "published": true,
          "valid": true
        },
        "expected_state": "available",
        "expected_value": "passed",
        "fact_id": "application.valid.evidence",
        "provenance": [
          "application_result",
          "application.valid"
        ],
        "source_kind": "application_result",
        "source_ref": "application.valid"
      }
    ],
    "mandatory": true,
    "policy_id": "evaluation.phase8",
    "reason": "The deterministic application must complete and publish its candidate.",
    "status": "passed"
  },
  "complete_repair_success": true,
  "diagnostic_artifact_retained": false,
  "evidence": [
    {
      "actual_state": "available",
      "actual_value": "passed",
      "expected_state": "available",
      "expected_value": "all mandatory gates passed",
      "fact_id": "run.summary",
      "provenance": [
        "evaluation_policy",
        "phase8.1"
      ],
      "source_kind": "evaluation_policy",
      "source_ref": "phase8.1"
    }
  ],
  "operations": [
    {
      "evidence": [
        {
          "actual_state": "available",
          "actual_value": {
            "l1": "passed",
            "l2": "passed"
          },
          "expected_state": "available",
          "expected_value": "L1 and L2 passed",
          "fact_id": "operation.phase12-v2-vvo-beam-loadbearing-restoration-beam-1",
          "provenance": [
            "operation_policy",
            "beam.add.l2"
          ],
          "source_kind": "operation_policy",
          "source_ref": "beam.add.l2"
        }
      ],
      "levels": [
        {
          "checks": [
            {
              "applicability": "required",
              "check_id": "l1.output.readable",
              "evidence": [
                {
                  "actual_state": "available",
                  "actual_value": {
                    "after_error": null,
                    "after_readable": true,
                    "before_error": null,
                    "before_readable": true
                  },
                  "expected_state": "available",
                  "expected_value": {
                    "after_readable": true,
                    "before_readable": true
                  },
                  "fact_id": "l1.output.readable.evidence",
                  "provenance": [
                    "ifc_reopen",
                    "repaired-ifc"
                  ],
                  "source_kind": "ifc_reopen",
                  "source_ref": "repaired-ifc"
                }
              ],
              "mandatory": true,
              "policy_id": "l1.common",
              "reason": "Both source and repaired IFC artifacts must reopen independently.",
              "status": "passed"
            },
            {
              "applicability": "required",
              "check_id": "l1.output.schema",
              "evidence": [
                {
                  "actual_state": "available",
                  "actual_value": "IFC2X3",
                  "expected_state": "available",
                  "expected_value": "IFC2X3",
                  "fact_id": "l1.output.schema.evidence",
                  "provenance": [
                    "ifc_schema",
                    "repaired-ifc"
                  ],
                  "source_kind": "ifc_schema",
                  "source_ref": "repaired-ifc"
                }
              ],
              "mandatory": true,
              "policy_id": "l1.common",
              "reason": "The repaired IFC schema must match the source IFC schema.",
              "status": "passed"
            },
            {
              "applicability": "required",
              "check_id": "l1.output.validation",
              "evidence": [
                {
                  "actual_state": "available",
                  "actual_value": {
                    "baseline_diagnostic_count": 0,
                    "baseline_status": "passed",
                    "cache": {
                      "baseline": {
                        "key": {
                          "diagnostic_normalization_version": "ifc-diagnostic-signature/0.1",
                          "ifc_schema": "IFC2X3",
                          "ifc_sha256": "sha256:a611a682c79a79ace18a16bf5f1497bf32fe43a9447b92af22168149b36d20e4",
                          "ifcopenshell_version": "0.8.5",
                          "validation_policy_version": "ifcopenshell-schema-no-express/0.1"
                        },
                        "key_digest": "sha256:ba46b36193201c012d2241d32cbfa253173783395fd468158481704c8599f12e",
                        "mode": "read_write",
                        "reason": "entry_missing",
                        "schema_version": "text2ifc/ifc-validation-cache/0.1",
                        "status": "miss"
                      },
                      "candidate": {
                        "key": {
                          "diagnostic_normalization_version": "ifc-diagnostic-signature/0.1",
                          "ifc_schema": "IFC2X3",
                          "ifc_sha256": "sha256:d60b997989c4441583d43d6e40d046a83cfbcb554874da83fd74f7cba80d5c83",
                          "ifcopenshell_version": "0.8.5",
                          "validation_policy_version": "ifcopenshell-schema-no-express/0.1"
                        },
                        "key_digest": "sha256:b07376cb606fc56fa2f059a946cce063ea703f4b78de63c7cabaa8419800320d",
                        "mode": "read_write",
                        "reason": "entry_missing",
                        "schema_version": "text2ifc/ifc-validation-cache/0.1",
                        "status": "miss"
                      }
                    },
                    "candidate_diagnostic_count": 0,
                    "execution": {
                      "diff_phase_peak_rss_bytes": 2156011520,
                      "mode": "accelerated",
                      "parent_current_rss_bytes": 2156011520,
                      "peak_rss_bytes": 2373750784,
                      "rss_limit_bytes": 4294967296,
                      "stage_seconds": {
                        "diff": 0.7189999999973224,
                        "validation": 4.188000000009197
                      },
                      "validation_phase_peak_rss_bytes": 2373750784,
                      "wall_seconds": 5.406999999991967,
                      "worker_count": 2,
                      "worker_peak_rss_bytes": {
                        "baseline": 125698048,
                        "candidate": 126066688
                      }
                    },
                    "new_diagnostic_count": 0,
                    "new_diagnostics": [],
                    "new_diagnostics_truncated": false,
                    "resolved_diagnostic_count": 0,
                    "schema_version": "text2ifc/ifc-validation-delta/0.1",
                    "status": "passed"
                  },
                  "expected_state": "available",
                  "expected_value": {
                    "new_diagnostic_count": 0
                  },
                  "fact_id": "l1.output.validation.evidence",
                  "provenance": [
                    "ifcopenshell_validation",
                    "damaged-to-repaired"
                  ],
                  "source_kind": "ifcopenshell_validation",
                  "source_ref": "damaged-to-repaired"
                }
              ],
              "mandatory": true,
              "policy_id": "l1.common",
              "reason": "The repaired IFC must not introduce IfcOpenShell validation diagnostics beyond the damaged baseline.",
              "status": "passed"
            },
            {
              "applicability": "required",
              "check_id": "l1.scope.created-roots",
              "evidence": [
                {
                  "actual_state": "available",
                  "actual_value": {
                    "after": {
                      "attribute_sha256": "sha256:f3f19447bc277d2e8d80420e51247d266d2d4292c64776b0f992775b0bcf0c01",
                      "containers": [
                        "1vTeahUkP60PdWqwCTjUuM"
                      ],
                      "geometry": {
                        "available": true,
                        "representation_sha256": "sha256:c9a995e3672fe4ea23ab7087c06e830df24821b6db9649e5b963c72b481d9b67"
                      },
                      "ifc_class": "IfcBeam",
                      "name": "Text2IFC beam phase12-v2-vvo-beam-loadbearing-restoration-beam-1",
                      "placement": [
                        [
                          0.0,
                          1.0,
                          0.0,
                          -3316.629521
                        ],
                        [
                          -1.0,
                          0.0,
                          0.0,
                          -3863.522838
                        ],
                        [
                          0.0,
                          0.0,
                          1.0,
                          1368.0
                        ],
                        [
                          0.0,
                          0.0,
                          0.0,
                          1.0
                        ]
                      ],
                      "snapshot_sha256": "sha256:a164c5b0d72b63dbacfd856de466acac86f127bfe27855a41d9b5b37a1cbc6d6",
                      "types": [